conference,year,title,authors,matched,title_similarity,matched_title,openalex_id,source_type,journal,publication_year,is_top_tier
Western Finance Association,2020,Asset Pricing with Heterogeneous Agents and Long-Run Risk,,True,1.0,Asset pricing with heterogeneous agents and long-run risk,https://doi.org/10.1016/j.jfineco.2021.01.005,journal,Journal of Financial Economics,2021,True
Western Finance Association,2020,Limited Household Risk-Sharing: General Equilibrium Implications for Interest Rates,Ole Wilms; Karl Schmedders; Walter Pohl,False,,,,,,,False
Western Finance Association,2020,SONOMA: a Small Open ecoNOmy for MAcroﬁnance,Indrajit Mitra; Yu Xu,True,1.0,SONOMA: a Small Open ecoNOmy for MAcrofinance,https://doi.org/10.17016/ifdp.2022.1349,journal,International Finance Discussion Papers,2022,False
Western Finance Association,2020,Optimal Time-Consistent Debt Policies,Mariano Croce; Mohammad Jahan-Parvar; Samuel Rosen,True,1.0,Optimal Time-Consistent Debt Policies,https://doi.org/10.2139/ssrn.3588163,journal-article,,2020,False
Western Finance Association,2020,Corporate Liquidity Management under Moral Hazard,Andrey Malenko; Anton Tsoy,False,,,,,,,False
Western Finance Association,2020,A Dynamic Theory of Learning and Relationship Lending,Barney Hartman-Glaser; Simon Mayer; Konstantin Milbradt,True,1.0,A Dynamic Theory of Learning and Relationship Lending,https://doi.org/10.2139/ssrn.3363685,journal-article,,2019,False
Western Finance Association,2020,How Does Liquidity Constraint Affect Employment and Wages? Evidence from Danish Mortgage Reform,Alex He; Daniel le Maire,True,0.726,Household Liquidity Constraints and Labor Market Outcomes: Evidence from a Danish Mortgage Reform,https://doi.org/10.1111/jofi.13277,journal,The Journal of Finance,2023,True
Western Finance Association,2020,Does Formal Credit Lead to More Financial Inclusion or Distress? Results Using a Strict Scoring Rule Amongst Marginal Clients in Paraguay,Viviane Azevedo; Jeanne Lafortune; Liliana Olarte; Jose Tessada,False,,,,,,,False
Western Finance Association,2020,Moral Hazard versus Liquidity in Household Bankruptcy,Sasha Indarte,True,1.0,Moral Hazard versus Liquidity in Household Bankruptcy,https://doi.org/10.1111/jofi.13263,journal,The Journal of Finance,2023,True
Western Finance Association,2020,Dark Knights: The Rise in Firm Intervention by CDS Investors,Andras Danis; Andrea Gamba,True,0.881,Dark Knights: The Rise in Firm Intervention by Credit Default Swap Investors,https://doi.org/10.1287/mnsc.2023.4717,journal,Management Science,2024,True
Western Finance Association,2020,Does Money Talk? Market Discipline through Selloffs and Boycotts,Nickolay Gantchev; Mariassunta Giannetti; Rachel Li,False,,,,,,,False
Western Finance Association,2020,Where Do Shareholder Gains in Hedge Fund Activism Come From? Evidence from Employee Pension Plans,Anup Agrawal; Yuree Lim,True,1.0,Where Do Shareholder Gains in Hedge Fund Activism Come From? Evidence From Employee Pension Plans,https://doi.org/10.1017/s002210902100082x,journal,Journal of Financial and Quantitative Analysis,2022,True
Western Finance Association,2020,Competition and Incentives in Mortgage Markets: The Role of Brokers,Claudia Robles-Garcia,False,,,,,,,False
Western Finance Association,2020,The Effects of Banking Competition on Growth and Financial Stability: Evidence from the National Banking Era,Stephan Luck; Mark Carlson; Sergio Correia,True,1.0,The Effects of Banking Competition on Growth and Financial Stability: Evidence from the National Banking Era,https://doi.org/10.1086/717453,journal,Journal of Political Economy,2022,True
Western Finance Association,2020,Market Power in Small Business Lending: A Two Dimensional Bunching Approach,Natalie Bachas; Ernest Liu,False,,,,,,,False
Western Finance Association,2020,Common Shocks in Stocks and Bonds,Anna Cieslak; Hao Pang,True,1.0,Common shocks in stocks and bonds,https://doi.org/10.1016/j.jfineco.2021.06.008,journal,Journal of Financial Economics,2021,True
Western Finance Association,2020,Central Banking with Many Voices: The Communications Arms Race,Annette Vissing-Jorgensen,False,,,,,,,False
Western Finance Association,2020,Informed Trading in the Government Bond Market,Robert Czech; Shiyang Huang; Dong Lou; Tianyu Wang,True,0.944,Informed trading in government bond markets,https://doi.org/10.1016/j.jfineco.2021.05.049,journal,Journal of Financial Economics,2021,True
Western Finance Association,2020,Economics of Proof-of-Stake Payment Systems,Giulia Fanti; Leonid Kogan; Pramod Viswanath,True,1.0,Economics of Proof-of-Stake Payment Systems,https://doi.org/10.2139/ssrn.4320274,journal-article,,2023,False
Western Finance Association,2020,Building Trust Takes Time: Limits to Arbitrage in Blockchain-Based Markets,Nikolaus Hautsch; Christoph Scheuch; Stefan Voigt,True,0.932,Building trust takes time: limits to arbitrage for blockchain-based assets,https://doi.org/10.1093/rof/rfae004,journal,Review of Finance,2024,True
Western Finance Association,2020,Decentalized Mining in Centralized Pools,Will Cong; Zhiguo He; Jiasun Li,True,0.988,Decentralized Mining in Centralized Pools,https://doi.org/10.1093/rfs/hhaa040,journal,The Review of Financial Studies,2020,True
Western Finance Association,2020,Trading and Shareholder Democracy,Doron Levit; Nadya Malenko; Ernst G. Maug,True,1.0,Trading and Shareholder Democracy,https://doi.org/10.1111/jofi.13289,journal,The Journal of Finance,2023,True
Western Finance Association,2020,"Group-Managed Real Options: Voting, Polarization, and Investment Dynamics",Lorenzo Garlappi; Ron M. Giammarino; Ali Lazrak,False,,,,,,,False
Western Finance Association,2020,Dynamic Blockholder Incentives: Liquidity and Reputation,Ivan Marinovic; Felipe Varas,False,,,,,,,False
Western Finance Association,2020,Investor Tax Credits and Entrepreneurship: Evidence from U.S. States,Matthew Denes; Sabrina Howell; Filippo Mezzanotti; Xinxin Wang; Ting Xu,True,1.0,Investor Tax Credits and Entrepreneurship: Evidence from U.S. States,https://doi.org/10.1111/jofi.13267,journal,The Journal of Finance,2023,True
Western Finance Association,2020,Keeping Options Open: What Motivates Entrepreneurs?,Sylvain Catherine,True,1.0,Keeping options open: What motivates entrepreneurs?,https://doi.org/10.1016/j.jfineco.2022.01.001,journal,Journal of Financial Economics,2022,True
Western Finance Association,2020,The Impact of Consumer Credit Access on Self-Employment and Entrepreneurship,Kyle Herkenhoff; Gordon M. Phillips; Ethan Cohen-Cole,True,1.0,The impact of consumer credit access on self-employment and entrepreneurship,https://doi.org/10.1016/j.jfineco.2021.03.004,journal,Journal of Financial Economics,2021,True
Western Finance Association,2020,Optimal Corporate Taxation Under Financial Frictions,Eduardo Davila; Benjamin Hebert,True,1.0,Optimal Corporate Taxation Under Financial Frictions,https://doi.org/10.1093/restud/rdac068,journal,The Review of Economic Studies,2022,True
Western Finance Association,2020,The Decline of Secured Debt,Efraim Benmelech; Nitish Kumar; Raghuram Rajan,True,1.0,The Decline of Secured Debt,https://doi.org/10.1111/jofi.13308,journal,The Journal of Finance,2024,True
Western Finance Association,2020,Ambiguous Credit Quality and Debt Maturity Structure,Shane Johnson; Hwagyun Kim; Ju Hyun Kim,True,0.897,Ambiguous Credit Information Quality and Debt Maturity Structure,https://doi.org/10.2139/ssrn.4029870,journal-article,,2022,False
Western Finance Association,2020,Comparing Asset Pricing Models with Non-Traded Factors and Principal Components,Rohit Allena,True,1.0,Comparing Asset Pricing Models with Non-Traded Factors and Principal Components,https://doi.org/10.2139/ssrn.3669940,journal-article,,2020,False
Western Finance Association,2020,Leveraged Funds and the Shadow Cost of Leverage Constraints,Zhongjin Lu; Zhongling Qin,True,1.0,Leveraged Funds and the Shadow Cost of Leverage Constraints,https://doi.org/10.1111/jofi.13012,journal,The Journal of Finance,2021,True
Western Finance Association,2020,Open-End Funds and Cross-Sectional Asset Returns,Minsoo Kim,False,,,,,,,False
Western Finance Association,2020,Desperate House Sellers: Distress Among Developers,Eileen van Straelen,True,1.0,Desperate House Sellers: Distress Among Developers,https://doi.org/10.17016/feds.2021.065,journal,Finance and Economics Discussion Series,2021,False
Western Finance Association,2020,Heterogeneous Real Estate Agents and the Housing Cycle,Sonia Gilbukh; Paul Goldsmith-Pinkham,True,1.0,Heterogeneous Real Estate Agents and the Housing Cycle,https://doi.org/10.1093/rfs/hhae048,journal,The Review of Financial Studies,2024,True
Western Finance Association,2020,Peak Bust Rental Spreads,Christopher Parsons; Marco Giacoletti,True,1.0,Peak-Bust rental spreads,https://doi.org/10.1016/j.jfineco.2021.05.061,journal,Journal of Financial Economics,2022,True
Western Finance Association,2020,Option-Implied Dependence and Correlation Risk Premium,Oleg Bondarenko; Carole Bernard,True,1.0,Option-Implied Dependence and Correlation Risk Premium,https://doi.org/10.1017/s0022109023000960,journal,Journal of Financial and Quantitative Analysis,2023,True
Western Finance Association,2020,Very Noisy Option Prices and Inference Regarding Option Returns,Jefferson Duarte; Christopher S. Jones; Junbo L. I. Wang,True,0.806,Very Noisy Option Prices and Inference Regarding the Volatility Risk Premium,https://doi.org/10.1111/jofi.13365,journal,The Journal of Finance,2024,True
Western Finance Association,2020,A Factor Model for Option Returns,Matthias Büchner; Bryan Kelly,True,1.0,A factor model for option returns,https://doi.org/10.1016/j.jfineco.2021.12.007,journal,Journal of Financial Economics,2022,True
Western Finance Association,2020,Is “Not Guilty” the Same as “Innocent”? Evidence from SEC Financial Fraud Investigations,David H. Solomon; Eugene Soltes,True,0.954,Is “Not Guilty” the Same as “Innocent”? Evidence from <scp>SEC</scp> Financial Fraud Investigations,https://doi.org/10.1111/jels.12282,journal,Journal of Empirical Legal Studies,2021,False
Western Finance Association,2020,Organized Crime and Firms: Evidence from Anti-Maﬁa Enforcement Actions,Pablo Slutzky; Stefan Zeume,True,0.993,Organized Crime and Firms: Evidence from Antimafia Enforcement Actions,https://doi.org/10.1287/mnsc.2021.00859,journal,Management Science,2024,True
Western Finance Association,2020,Deleting Misconduct: The Expungement of BrokerCheck Records,Colleen Honigsberg; Matthew Jacob,True,1.0,Deleting misconduct: The expungement of BrokerCheck records,https://doi.org/10.1016/j.jfineco.2020.10.002,journal,Journal of Financial Economics,2021,True
Western Finance Association,2020,"ESG Preference, Institutional Trading, and Stock Return Patterns",Jie Cao; Sheridan Titman; Xintong Zhan; Weiming Zhang,True,1.0,"ESG Preference, Institutional Trading, and Stock Return Patterns",https://doi.org/10.1017/s0022109022000916,journal,Journal of Financial and Quantitative Analysis,2022,True
Western Finance Association,2020,Stranded Fossil Fuel Reserves and Firm Value,Christina Atanasova; Eduardo Schwartz,True,1.0,Stranded Fossil Fuel Reserves and Firm Value,https://doi.org/10.3386/w26497,report,,2019,False
Western Finance Association,2020,Asset Prices and Portfolios with Externalities,Steven Baker; Burton Holliﬁeld; Emilio Osambela,True,1.0,Asset Prices and Portfolios with Externalities,https://doi.org/10.1093/rof/rfac065,journal,Review of Finance,2022,True
Western Finance Association,2020,Benchmark Interest Rates When the Government is Risky,Patrick Augustin; Mikhail Chernov; Lukas Schmid; Dongho Song,True,1.0,Benchmark interest rates when the government is risky,https://doi.org/10.1016/j.jfineco.2020.10.009,journal,Journal of Financial Economics,2021,True
Western Finance Association,2020,The U.S. Public Debt Valuation Puzzle,Zhengyang Jiang; Hanno Lustig; Stijn Van Nieuwerburgh; Mindy Z. Xiaolan,True,1.0,The U.S. Public Debt Valuation Puzzle,https://doi.org/10.3982/ecta20497,journal,Econometrica,2024,True
Western Finance Association,2020,"Learning, Equilibrium Trend, Cycle, and Spread in Bond Yields",Guihai Zhao,True,1.0,"Learning, Equilibrium Trend, Cycle, and Spread in Bond Yields",https://doi.org/10.2139/ssrn.3762095,journal-article,,2020,False
Western Finance Association,2020,Capital Budgeting and Idiosyncratic Risk,Paul Decaire,True,1.0,Capital Budgeting and Idiosyncratic Risk,https://doi.org/10.2139/ssrn.3480884,journal-article,,2019,False
Western Finance Association,2020,Delayed Creative Destruction: How Uncertainty Shapes Corporate Asset Allocation,Murillo Campello; Gaurav Kankanhalli; Hyunseob Kim,True,0.918,Delayed creative destruction: How uncertainty shapes corporate assets,https://doi.org/10.1016/j.jfineco.2024.103786,journal,Journal of Financial Economics,2024,True
Western Finance Association,2020,Do Nonﬁnancial Firms Use Financial Assets to Take Risk? Evidence from the 2014 Oil Price Crisis,Ran Duchin; Zhiyao Chen,True,0.733,Do Nonfinancial Firms Use Financial Assets to Take Risk?,https://doi.org/10.1093/rcfs/cfac040,journal,The Review of Corporate Finance Studies,2022,False
Western Finance Association,2020,Deposit Withdrawals,Nikolaos Artavanis; Daniel Paravisini; Claudia Robles-Garcia; Amit Seru; Margarita Tsoutsoura,False,,,,,,,False
Western Finance Association,2020,Beyond the Balance Sheet Model of Banking: Implications for Bank Regulation and Monetary Policy,Greg Buchak; Gregor Matvos; Tomasz Piskorski; Amit Seru,True,1.0,Beyond the Balance Sheet Model of Banking: Implications for Bank Regulation and Monetary Policy,https://doi.org/10.1086/726703,journal,Journal of Political Economy,2024,True
Western Finance Association,2020,Zombie Credit and (Dis-)Inﬂation: Evidence from Europe,Viral V . Acharya; Matteo Crosignani; Tim Eisert; Christian Euﬁnger,True,1.0,Zombie Credit and (Dis‐)Inflation: Evidence from Europe,https://doi.org/10.1111/jofi.13342,journal,The Journal of Finance,2024,True
Western Finance Association,2020,Trading on Long-Term Information,Corey Garriott; Ryan Riordan,True,1.0,Trading on Long-Term Information,https://doi.org/10.2139/ssrn.3419065,journal-article,,2019,False
Western Finance Association,2020,Effects of a Speed Bump on Market Quality and Exchange Competition,Bidisha Chakrabarty; Jianning Huang; Pankaj K. Jain,False,,,,,,,False
Western Finance Association,2020,"""Sniping"" in Fragmented Markets",Katya Malinova; Andreas Park,True,1.0,'Sniping' in Fragmented Markets,https://doi.org/10.2139/ssrn.3534367,journal-article,,2020,False
Western Finance Association,2020,Investment Sophistication and Wealth Inequality,Ehsan Azarmsa,True,1.0,Investment sophistication and wealth inequality,https://doi.org/10.1016/j.jet.2026.106206,journal,Journal of Economic Theory,2026,False
Western Finance Association,2020,Wealth Shares in the Long Run,Geoffery X. Zheng,False,,,,,,,False
Western Finance Association,2020,The Consumption Effects of the Disposition to Sell Winners and Hold Losers,Benjamin Loos; Steffen Meyer; Michaela Pagel,True,1.0,The Consumption Effects of the Disposition to Sell Winners and Hold Losers,https://doi.org/10.3386/w26668,report,,2020,False
Western Finance Association,2020,Do the Right Firms Survive Bankruptcy?,Matthieu Gomez; Jianfeng Yu; Benjamin Iverson,True,1.0,Do the right firms survive bankruptcy?,https://doi.org/10.1016/j.jfineco.2021.07.006,journal,Journal of Financial Economics,2022,True
Western Finance Association,2020,Social Collateral,Samuel Antill,False,,,,,,,False
Western Finance Association,2020,Financial Constraints and Product Market Decisions: the Role of Production Cycles,Ha Diep-Nguyen; Huong Dang,True,1.0,Financial Constraints and Product Market Decisions: The Role of Production Cycles,https://doi.org/10.2139/ssrn.3596061,journal-article,,2020,False
Western Finance Association,2020,Financing Competitors,Diogo Mendes,True,1.0,Financing Competitors,https://doi.org/10.2139/ssrn.3556917,journal-article,,2019,False
Western Finance Association,2020,Cheap Trade Credit and Competition in Downstream Markets,Erica Xuewei Jiang,True,1.0,Cheap Trade Credit and Competition in Downstream Markets,https://doi.org/10.1086/713731,journal,Journal of Political Economy,2021,True
Western Finance Association,2020,Product Market Strategy and Corporate Policies,Mariassunta Giannetti; Nicolas Serrano-Velarde; Emanuele Tarantino,True,1.0,Product market strategy and corporate policies,https://doi.org/10.1016/j.jfineco.2022.09.003,journal,Journal of Financial Economics,2022,True
Western Finance Association,2020,Sitting Bucks: Zero Returns in Fixed Income Funds,Jakub Hajda,False,,,,,,,False
Western Finance Association,2020,A Horizon Based Decomposition of Mutual Fund Skill using Transaction Data,Jaewon Choi; Mathias Kronlund; Ji Yeol Jimmy Oh,False,,,,,,,False
Western Finance Association,2020,The Performance of Diverse Teams: Evidence from U.S. Mutual Funds,Jules Van Binsbergen; Hongxun Ruan; Ran Xing,True,1.0,The Performance of Diverse Teams: Evidence from U.S. Mutual Funds,https://doi.org/10.2139/ssrn.3505619,journal-article,,2019,False
Western Finance Association,2020,Safe Assets as Collateral Multipliers,Richard Evans; Melissa Prado; Antonino Emanuele Rizzo; Rafael Zambrana,False,,,,,,,False
Western Finance Association,2020,The Employee Clientele of Corporate Leverage: Evidence from Family Labor Income Diversiﬁcation,Emre Ozdenoren; Kathy Yuan; Shengxing Zhang,True,1.0,The Employee Clientele of Corporate Leverage: Evidence from Family Labor Income Diversification,https://doi.org/10.1017/s0022109025000031,journal,Journal of Financial and Quantitative Analysis,2025,True
Western Finance Association,2020,Robust Security Design,Jie He; Tao Shu; Huan Yang,False,,,,,,,False
Western Finance Association,2020,Human Interactions and Financial Investment: A Video-Based Approach,Seokwoo Lee; Uday Rajan,True,1.0,Human Interactions and Financial Investment: A Video-Based Approach,https://doi.org/10.2139/ssrn.3583898,journal-article,,2020,False
Western Finance Association,2020,The Leveraging of Silicon Valley: Venture Debt in the Innovation Economy,Yael Hochberg; Allen Hu; Song Ma,False,,,,,,,False
Western Finance Association,2020,The Evolution of CEO Compensation in Venture Capital Backed Startups,Jesse Davis; Adair Morse; Xinxin Wang,True,1.0,The Evolution of CEO Compensation in Venture Capital Backed Startups,https://doi.org/10.2139/ssrn.3621801,journal-article,,2020,False
Western Finance Association,2020,Interbank Networks in the Shadows of the Federal Reserve Act,Michael Ewens; Ramana Nanda; Christopher Stanton,True,1.0,Interbank Networks in the Shadows of the Federal Reserve Act,https://doi.org/10.3386/w27721,report,,2020,False
Western Finance Association,2020,Bank Debt versus Fund Equity in Liquidity Provision,Haelim Anderson; Selman Erol; Guillermo Ordoñez,False,,,,,,,False
Western Finance Association,2020,"Interbank Trading, Collusion, and Financial Regulation",Yiming Ma; Kairong Xiao; Yao Zeng,False,,,,,,,False
Western Finance Association,2020,The Perils of Private Provision of Public Goods,Michael Gofman; Dean Corbae,True,1.0,The Perils of Private Provision of Public Goods,https://doi.org/10.2139/ssrn.3531171,journal-article,,2020,False
Western Finance Association,2020,Shareholder Illiquidity and Firm Behavior: Financial and Real Effects of the Personal Wealth Tax in Private Firms,Umit Gurun; Jordan Nickerson; David H. Solomon,True,1.0,Shareholder Illiquidity and Firm Behavior: Financial and Real Effects of the Personal Wealth Tax in Private Firms,https://doi.org/10.2139/ssrn.3475412,journal-article,,2019,False
Western Finance Association,2020,Reusing Natural Experiments,Janis Berzins; Oyvind Bohren; Bogdan Stacescu,True,1.0,Reusing Natural Experiments,https://doi.org/10.17016/ifdp.2022.1339,journal,International Finance Discussion Papers,2022,False
Western Finance Association,2020,Credit Market Equivalents and the Valuation of Private Firms,Davidson Heath; Ingrid M. Werner; Mehrdad Samadi; Matthew Ringgenberg,True,1.0,Credit Market Equivalents and the Valuation of Private Firms,https://doi.org/10.2139/ssrn.3463333,journal-article,,2022,False
Western Finance Association,2020,Ex Ante Risk in the Corporate Bond Market: Evidence from Synthetic Options,Niklas Huether; Lukas Schmid; Roberto Steri,False,,,,,,,False
Western Finance Association,2020,"Machine Learning, Human Experts, and the Valuation of Real Assets",Steven Shu-Hsiu Chen; Hitesh Doshi; Sang Byung Seo,False,,,,,,,False
Western Finance Association,2020,Technology Development and Corporate Mergers,Mathieu Aubry; Roman Kraussl; Gustavo Manso; Christophe Spaenjers,False,,,,,,,False
Western Finance Association,2020,Seeking Efﬁciency or Price Gouging? Evidence from Pharmaceutical Mergers,Danqing Mei,True,1.0,Seeking efficiency or price gouging? Evidence from pharmaceutical mergers,https://doi.org/10.1016/j.jcorpfin.2024.102623,journal,Journal of Corporate Finance,2024,False
Western Finance Association,2020,The Economic Effects of Private Equity Buyouts,Mosab Hammoudeh; Amrita Nain,False,,,,,,,False
Western Finance Association,2020,Uncertainty about What’s in the Price,Steven J. Davis; John Haltiwanger; Kyle Handley; Javier Miranda; Josh Lerner,False,,,,,,,False
Western Finance Association,2020,Bank-Intermediated Arbitrage,Daniel Schmidt; Joel Peress,False,,,,,,,False
Western Finance Association,2020,Market Efﬁciency in the Age of Big Data,Nina Boyarchenko; Thomas M. Eisenbach; Pooja Gupta; Or Shachar; Peter Van Tassel,True,1.0,Market Efficiency in the Age of Big Data,https://doi.org/10.3386/w26586,report,,2019,False
Western Finance Association,2020,Global Portfolio Rebalancing and Exchange Rates,Ian Martin; Stefan Nagel,True,1.0,Global Portfolio Rebalancing and Exchange Rates,https://doi.org/10.1093/rfs/hhac023,journal,The Review of Financial Studies,2022,True
Western Finance Association,2020,"Gravity, Counterparties and Foreign Investment",Adrien Verdelhan; Nelson Camanho; Harald Hau; Helene Rey,True,1.0,"Gravity, counterparties, and foreign investment",https://doi.org/10.1016/j.jfineco.2021.09.011,journal,Journal of Financial Economics,2022,True
Western Finance Association,2020,Foreign Investment of US Multinationals: The Effect of Tax Policy and Agency Conﬂicts,Cristian Badarinza; Tarun Ramadorai; Chihiro Shimizu,True,1.0,Foreign investment of US multinationals: The effect of tax policy and agency conflicts.,https://doi.org/10.1016/j.jfineco.2021.06.004,journal,Journal of Financial Economics,2022,True
Western Finance Association,2020,Falling Behind: Has Rising Inequality Fueled the American Debt Boom?,James Albertus; Brent Glover; Oliver Levine,True,1.0,Falling Behind: Has Rising Inequality Fueled the American Debt Boom?,https://doi.org/10.1093/rfs/hhaf062,journal,The Review of Financial Studies,2025,True
Western Finance Association,2020,Stock Portfolio and Housing Choice when the Stock and Housing Markets are Cointegrated,Moritz Drechsel-Grau; Fabian Greimel,False,,,,,,,False
Western Finance Association,2020,The Gender Gap in Housing Returns,Yingshan Chen; Min Dai; Shan Huang; Hong Liu,True,1.0,The Gender Gap in Housing Returns,https://doi.org/10.1111/jofi.13212,journal,The Journal of Finance,2023,True
Western Finance Association,2020,"Bitcoin as Decentralized Money: Prices, Mining, and Network Security",Paul Goldsmith-Pinkham; Kelly Shue,False,,,,,,,False
Western Finance Association,2020,Proof-of-Work (PoW) Blockchain Network and Its Viability as a Payment System,Emiliano Pagnotta,True,1.0,Proof-of-Work (PoW) Blockchain Network and Its Viability as a Payment System,https://doi.org/10.2139/ssrn.3441605,journal-article,,2019,False
Western Finance Association,2020,Miner Collusion and the BitCoin Protocol,Ping He; Dunzhe Tang; Jingwen Wang,True,1.0,Miner Collusion and the BitCoin Protocol,https://doi.org/10.2139/ssrn.3559894,journal-article,,2020,False
Western Finance Association,2020,The Real Effects of Secondary Market Trading Structure: Evidence from the Mortgage Market,Alfred Lehar; Christine A. Parlour,True,1.0,The Real Effects of Secondary Market Trading Structure: Evidence from the Mortgage Market,https://doi.org/10.1093/rfs/hhab116,journal,The Review of Financial Studies,2021,True
Western Finance Association,2020,The Value of Intermediation in the Stock Market,Yesol Huh; You Suk Kim,True,1.0,The value of intermediation in the stock market,https://doi.org/10.1016/j.jfineco.2021.08.020,journal,Journal of Financial Economics,2022,True
Western Finance Association,2020,Quantifying the High-Frequency Trading “Arms Race”: A Simple New Methodology and Estimates,Marco Di Maggio; Mark Egan; Francesco Franzoni,True,1.0,Quantifying the High-Frequency Trading “Arms Race”: A Simple New Methodology and Estimates,https://doi.org/10.2139/ssrn.3636323,journal-article,,2020,False
Western Finance Association,2020,"Extrapolative Expectations, Corporate Activities, and Asset Prices",Matteo Aquilina; Eric Budish; Peter O’Neill,True,1.0,"Extrapolative Expectations, Corporate Activities, and Asset Prices",https://doi.org/10.2139/ssrn.3771930,journal-article,,2021,False
Western Finance Association,2020,Capital Misallocation and Risk Sharing,Yao Deng,True,1.0,Capital Misallocation and Risk Sharing,https://doi.org/10.2139/ssrn.3521553,journal-article,,2019,False
Western Finance Association,2020,Debt Dynamics and Credit Risk,Hengjie Ai; Anmol Bhandari; Yuchen Chen; Chao Ying,True,1.0,Debt dynamics and credit risk,https://doi.org/10.1016/j.jfineco.2023.06.007,journal,Journal of Financial Economics,2023,True
Western Finance Association,2020,Asset Pricing with Fading Memory,Peter Feldhütter; Stephen Schaefer,True,1.0,Asset Pricing with Fading Memory,https://doi.org/10.1093/rfs/hhab086,journal,The Review of Financial Studies,2021,True
