conference,year,title,authors
Western Finance Association,2022,Competition and the Reputational Costs of Litigation,Jonathan Brogaard; James Brugler; Dominik Rosch
Western Finance Association,2022,Financing the Litigation Arms Race,Felix von Meyerinck; Vesa Pursiainen; Markus Schmid
Western Finance Association,2022,Do Health Risks Shape Firm Boundaries?,Samuel Antill; Steven Grenadier
Western Finance Association,2022,Who Beneﬁts from Retirement Saving Incentives in the U.S.? Evidence on Racial Gaps in Retirement Wealth Accumulation,Adrian Lam
Western Finance Association,2022,Gender Bias in Promotions: Evidence from Financial Institutions,Taha Choukhmane; Jorge Colmenares; Cormac O’Dea; Jonathan Rothbaum; Lawrence D. W. Schmidt
Western Finance Association,2022,Hidden Alpha,Ruidi Huang; Erik Mayer; Darius Miller
Western Finance Association,2022,On the Road to Better Governance: Private Meetings and Mutual Fund Voting,Alexander Cochardt; Lauren H. Cohen; Stephan Heller
Western Finance Association,2022,Passive Ownership and Price Informativeness,Jesse Ellis; William Gerken; Russell Jame
Western Finance Association,2022,Liquidity Provision to Leveraged ETFs and Equity Options Rebalancing Flows - Evidence from End-of-Day Stock Prices,Marco Sammon
Western Finance Association,2022,Short-Squeeze Bubbles,Andrea Barbon; Heiner Beckmeyer; Andrea Buraschi; Mathis Moerke
Western Finance Association,2022,A Long and a Short Leg Make For a Wobbly Equilibrium,Bernardo Guimaraes; Pierluca Pannella
Western Finance Association,2022,Squeezing Shorts Through Social Media Platforms,Nicolae Gârleanu; Stavros Panageas; Geoffery X. Zheng
Western Finance Association,2022,Bank Incentives and the Effect of the Paycheck Protection Program,Franklin Allen; Marlene Haas; Eric Nowak; Matteo Pirovan; Angel Tengulov
Western Finance Association,2022,"The Core, the Periphery, and the Disaster: Corporate-Sovereign Nexus in COVID-19 Times",Gustavo Joaquim; Felipe Netto
Western Finance Association,2022,Do Credit Markets Respond to Macroeconomic Shocks? The Case for Reverse Causality,Ruggero Jappelli; Loriana Pelizzon; Alberto Plazzi
Western Finance Association,2022,Heterogeneous Investors and Stock Market Fluctuations,Giorgio Ottonello; Martijn Boons; Rossen Valkanov
Western Finance Association,2022,The Real Channel for Nominal Bond-Stock Puzzles,Sebastian Hillenbrand; Odhrain McCarthy
Western Finance Association,2022,Dynamics of Asset Demands with Conﬁdence Heterogeneity,Mikhail Chernov; Lars A. Lochstoer; Dongho Song
Western Finance Association,2022,Measuring the Welfare Cost of Asymmetric Information in Consumer Credit Markets,Adrian Buss; Raman Uppal; Grigory Vilkov
Western Finance Association,2022,The Cost of Consumer Collateral: Evidence from Bunching,Anthony DeFusco; Huan Tang; Constantine Yannelis
Western Finance Association,2022,Mortgage Leverage and House Prices,Benjamin Collier; Cameron M. Ellis; Benjamin J. Keys
Western Finance Association,2022,The Rise of Reddit: How Social Media Affects Retail Investors and Short-sellers’ Roles in Price Discovery,Stephanie Johnson
Western Finance Association,2022,Should Retail Investors Listen to Social Media Analysts? Evidence from Text-Implied Beliefs,Danqi Hu; Charles M. Jones; Valerie Zhang; Xiaoyan Zhang
Western Finance Association,2022,Political Polarization in Financial News,Chukwuma Dim
Western Finance Association,2022,The Effects of Going Public on Firm Performance and Commercialization Strategy: Evidence from International IPOs,Eitan Goldman; Nandini Gupta; Ryan Israelsen
Western Finance Association,2022,Hype Cycles: Dynamic Information Design with Two Audiences,Borja Larrain; Gordon M. Phillips; Giorgo Sertsios; Francisco Urzua
Western Finance Association,2022,What Works Best in Capital Budgeting?,Xuelin Li; Martin Szydlowski; Fangyuan Yu
Western Finance Association,2022,Maturity Increasing Overreaction and Bond Market Puzzles,Nicolas Hommel; Augustin Landier; David Thesmar
Western Finance Association,2022,Demand-Supply Imbalance Risk and Long-Term Swap Spreads,Daniele d’Arienzo
Western Finance Association,2022,Can Monetary Policy Create Fiscal Capacity?,Sam Hanson; Aytek Malkhozov; Gyuri Venter
Western Finance Association,2022,The Inference-Forecast Gap in Belief Updating,Vadim Elenev; Tim Landvoigt; Patrick J. Shultz; Stijn Van Nieuwerburgh
Western Finance Association,2022,Sluggish Price Reaction to Salient and Repeated Macroeconomic Releases,Tony Fan; Yucheng Liang; Cameron Peng
Western Finance Association,2022,Human Frictions in the Transmission of Economic Policy,Jian Feng; Shiyang Huang; Jiacui Li; Yang Song
Western Finance Association,2022,Equilibrium Staking Levels in a Proof-of-Stake Blockchain,Francesco D’Acunto; Daniel Hoang; Maritta Paloviita; Michael Weber
Western Finance Association,2022,The Rise of Finance Companies and FinTech Lenders in Small Business Lending,Kose John; Thomas Rivera; Fahad Saleh
Western Finance Association,2022,Fintech Expansion,Manasa Gopal; Philipp Schnabl
Western Finance Association,2022,"Corporate Tax Avoidance, Firm Size, and Capital Misallocation",Jing Huang
Western Finance Association,2022,How Does Removing the Tax Beneﬁts of Debt Affect Firms? Evidence from the 2017 US Tax Reform,Brent Glover; Oliver Levine
Western Finance Association,2022,"Tax Incentives, Small Businesses, and Physical Capital Reallocation",Ali Sanati
Western Finance Association,2022,Paying off the Competition: Market Power and Innovation Incentives,Doyeon Kim; Manpreet Singh; Riddha Basu
Western Finance Association,2022,Pay to Play in Investment Management,Xuelin Li; Andrew W. Lo; Richard Thakor
Western Finance Association,2022,Did FinTech Lenders Facilitate PPP Fraud?,William C. Beggs; Thuong Harvison
Western Finance Association,2022,Entrepreneurship and the Platform Economy: Evidence from U.S. Tax Returns,John M. Grifﬁn; Samuel Kruger; Prateek Mahajan
Western Finance Association,2022,The Distributional Impact of the Sharing Economy on the Housing Market,Matthew Denes; Spyridon Lagaras; Margarita Tsoutsoura
Western Finance Association,2022,The Conglomerate Network,Sophie Calder-Wang
Western Finance Association,2022,A Quantity-Based Approach to Constructing Climate Risk Hedge Portfolios,Kenneth Ahern; Lei Kong; Xinyan Yan
Western Finance Association,2022,The Optimal Design of Green Securities,Georgij Alekseev; Stefano Giglio; Quinn Maingi; Julia Selgrad; Johannes Stroebel
Western Finance Association,2022,A Corporate Finance Perspective on Environmental Policy,Adelina Barbalau; Federica Zeni
Western Finance Association,2022,Treasury Bill Shortages and the Pricing of Short-Term Assets,Florian Heider; Roman Inderst
Western Finance Association,2022,Asymmetric Monetary Policy Expectations,Quentin Vandeweyer; Adrien d’Avernas
Western Finance Association,2022,The Fed and the Secular Decline in Interest Rates,Anthony Diercks; Hiroatsu Tanaka; Paul Cordova
Western Finance Association,2022,"Creditor Rights, Collateral Reuse, and Credit Supply",Sebastian Hillenbrand
Western Finance Association,2022,Information Frictions in Credit Markets,Brittany Lewis
Western Finance Association,2022,Dissecting Lender Market Power in Distressed Loan Pricing,Clément Mazet-Sonilhac
Western Finance Association,2022,Index Providers: Whales Behind the Scenes of ETFs,Winston Dou; Wei Wang; Wenyu Wang
Western Finance Association,2022,The Market for Fund Benchmarks: Evidence from ETFs,Yang Song; Matteo Benetton; Yu An
Western Finance Association,2022,Returns to Scale among Corporate Bond Mutual Funds,Leonard Kostovetsky; Jerold Warner
Western Finance Association,2022,Dividend Momentum and Stock Return Predictability: A Bayesian Approach,Zhen Yan
Western Finance Association,2022,Finite Sample Analysis of Predictive Regressions with Long-Horizon Returns,Juan Antolin-Diaz; Ivan Petrella; Juan Rubio-Ramirez
Western Finance Association,2022,Expectation-Driven Term Structure of Equity and Bond Yields,Raymond Kan; Jiening Pan
Western Finance Association,2022,Consumption out of Fictitious Capital Gains and Selective Inattention,Guihai Zhao; Ming Zeng
Western Finance Association,2022,Propagating Experiences by Competing: Micro-Level Evidence from Real Estate,Benjamin Loos; Steffen Meyer; Michaela Pagel
Western Finance Association,2022,Macroeconomic Expectations and Credit Card Spending,Christopher Parsons; Mikhail Galashin; Martin Kanz; Ricardo Perez-Truglia
Western Finance Association,2023,"The USC Marshall School of Business Trefftzs Award of $5,000 for the best student paper.",
Western Finance Association,2023,"Charles River Associates Award of $5,000 for the best paper on corporate finance.",
Western Finance Association,2023,"Elsevier Sponsored Award of $5,000 for the best paper on financial institutions.",
Western Finance Association,2023,"PBCSF Award of $5,000 for the best paper in fintech",
Western Finance Association,2023,"NASDAQ Award of $5,000 for the best paper on asset pricing.",
Western Finance Association,2023,"Two Sigma Award of $5,000 for the best paper on Investment Management.",
Western Finance Association,2023,"Wharton School - WRDS Award of $5,000 for the best empirical finance paper.",
Western Finance Association,2023,The Brattle Group Ph.D. Candidate Awards.,
