conference,year,title,authors
Western Finance Association,2021,The Market Risk Premium for Unsecured Consumer Credit Risk,Matthias Fleckenstein; Francis Longstaff
Western Finance Association,2021,Monetary Policy and Wealth Effects: The Role of Risk and Heterogeneity,Dejanir Silva; Nicolas Caramp
Western Finance Association,2021,The Burden of Supervision,Giovanni Cerulli; Franco Fiordelisi; David Marques-Ibanez
Western Finance Association,2021,The Real Effects of Bank Supervision: Evidence from On-Site Bank Inspections,Andrea Passalacqua; Paolo Angelini; Francesca Lotti; Giovanni Soggia
Western Finance Association,2021,"Internal Models, Make Believe Prices, and Bond Market Cornering",Ishita Sen; Varun Sharma
Western Finance Association,2021,Banking without Deposits: Evidence from Shadow Bank Call Reports,Erica Xuewei Jiang; Gregor Matvos; Tomasz Piskorski; Amit Seru
Western Finance Association,2021,Using High-Frequency Evaluations to Estimate Discrimination: Evidence from Mortgage Loan Ofﬁcers,Marco Giacoletti; Rawley Heimer; Edison Yu
Western Finance Association,2021,Arbitraging Covered Interest Rate ParityDeviations and Bank Lending,Lorena Keller
Western Finance Association,2021,Mind Thy Neighbor’s Portfolio: A Network Approach to Contagion in the ETF Market,Bruce Iwadate
Western Finance Association,2021,Dominated ETFs,David C. Brown; Scott Cederburg; Mitch Towner
Western Finance Association,2021,Exploited by Complexity,Pengjie Gao; Allen Hu; Peter Kelly; Cameron Peng; Ning Zhu
Western Finance Association,2021,The Boundaries of the Law: Can US Private Enforcement Discipline Foreign Firms?,Massimo Massa; Xiaoqiao Wang; Bohui Zhang; Hong Zhang
Western Finance Association,2021,Misallocation and Capital Market Integration: Evidence from India,Natalie Bau; Adrien Matray
Western Finance Association,2021,Sovereign Debt Ratchets and Welfare Destruction,Peter M. DeMarzo; Zhiguo He; Fabrice Tourre
Western Finance Association,2021,Attention Induced Trading and Returns: Evidence from Robinhood Users,Brad M. Barber; Xing Huang; Terrance Odean; Christopher Schwarz
Western Finance Association,2021,The Effect of Stock Ownership on Individual Spending and Loyalty,Paolina Medina; Vrinda Mittal; Michaela Pagel
Western Finance Association,2021,Memory and Trading,Constantin Charles
Western Finance Association,2021,"Scope, Scale and Competition: The 21st Century Firm",Gerard T. Hoberg; Gordon M. Phillips
Western Finance Association,2021,Product Differentiation and Oligopoly: A Network Approach,Bruno Pellegrino
Western Finance Association,2021,Capital Structure under Imperfect Product Market Competition: Theory and Evidence,Hae Won (Henny) Jung; Dalida Kadyrzhanova; Ajay Subramanian
Western Finance Association,2021,The Value of Privacy: Evidence from Online Borrowers,Huan Tang
Western Finance Association,2021,Rise of the Machines: The Impact of Automated Underwriting,Mark Jansen
Western Finance Association,2021,Is Public Debt Arm’s-Length? Evidence from Corporate Bond Purchases of Life Insurance Companies,Hieu Nguyen; Amin Shams; Monica Barbosa; Ali Ozdagli
Western Finance Association,2021,Modeling Corporate Bond Returns,Jennie Bai
Western Finance Association,2021,Under- and Over-Reaction in Yield Curve Expectations,Bryan Kelly; Diogo Palhares; Seth Pruitt; Chen Wang
Western Finance Association,2021,Marking to Market Corporate Debt,Lorenzo Bretscher; Peter Feldhütter; Andrew Kane; Lukas Schmid
Western Finance Association,2021,In Search of the Origins of Financial Fluctuations: The Inelastic Markets Hypothesis,Arvind Krishnamurthy; Xavier Gabaix; Ralph Koijen
Western Finance Association,2021,Value Without Employment,Simcha Barkai; Stavros Panageas
Western Finance Association,2021,The Finance Uncertainty Multiplier,Ivan Alfaro; Nicholas Bloom; Xiaoji Lin
Western Finance Association,2021,Vestigial Tails? Floor Brokers at the Close in Modern Electronic Markets,Edwin Hu; Dermot Murphy
Western Finance Association,2021,True Cost of Immediacy,Terrence Hendershott; Dan Li; Dmitry Livdan; Norman Schürhoff
Western Finance Association,2021,Equilibrium Data Mining and Data Abundance,Jerome Dugast; Thierry Foucault
Western Finance Association,2021,Wealth Fluctuations and Risk Preferences: Evidence from U.S. Investor Portfolios,Francisco Gomes; Maarten Meeuwis
Western Finance Association,2021,Student Loans and Social Mobility,Mehran Ebrahimian
Western Finance Association,2021,Financial Returns to Household Inventory Management,Scott R. Baker; Stephanie Johnson; Lorenz Kueng
Western Finance Association,2021,Mutual Fund Revenue Sharing in 401(k) plans,Umit Gurun; Veronika K. Pool; Clemens Sialm; Irina Stefanescu
Western Finance Association,2021,The Effect of Advisors’ Incentives on Clients’ Investments,Diego Battiston; Jordi Blanes i Vidal; Rafael Hortala-Vallve; Dong Lou
Western Finance Association,2021,Choosing Investment Managers,Amit Goyal; Sunil Wahal; M. Deniz Yavuz
Western Finance Association,2021,Local Journalism under Private Equity Ownership,Michael Ewens; Arpit Gupta; Sabrina T. Howell
Western Finance Association,2021,Do Bank Insiders Impede Equity Issuances?,Martin R. Goetz; Luc Laeven; Ross Levine
Western Finance Association,2021,Competing with Security Design,Yue Yuan
Western Finance Association,2021,"Mutual Fund Fragility, Dealer Liquidity Provisions, and the Pricing of Municipal Bonds",Yi Li; Maureen O’Hara; Xing Zhou
Western Finance Association,2021,Mutual Fund Liquidity Transformation and Reverse Flight to Liquidity,Yiming Ma; Kairong Xiao; Yao Zeng
Western Finance Association,2021,Dealers and the Dealer of Last Resort: Evidence from MBS Markets in the COVID-19 Crisis,Zhaogang Song; Jiakai Chen; Haoyang Liu; Asani Sarkar
Western Finance Association,2021,Is There Too Much Benchmarking in Asset Management?,Anil Kashyap; Natalia Kovrijnykh; Jian Li; Anna Pavlova
Western Finance Association,2021,Statistical Arbitrage with Uncertain Fat Tails,Bo Hu; Wen Chen
Western Finance Association,2021,Information Acquisition and the Pre-Announcement Drift,Hengjie Ai; Ravi Bansal; Leyla Jianyu Han
Western Finance Association,2021,CLO Performance,Larry Cordell; Michael Roberts; Michael Schwert
Western Finance Association,2021,The Externalities of Fire Sales: Evidence from Collateralized Loan Obligations,Shohini Kundu
Western Finance Association,2021,Fire-Sale Risk in the Leveraged Loan Market,Redouane Elkamhi; Yoshio Nozawa
Western Finance Association,2021,Opening up Military Innovation: Causal Effects of ‘Bottom-Up’ Reforms to U.S. Defense Research,Sabrina T. Howell; Jason Rathje; John Van Reenen; Jun Wong
Western Finance Association,2021,The Role of Assets In Place: Loss of Market Exclusivity and Investment,Matthew Higgins; Mathias Kronlund; Ji Min Park; Joshua Pollet
Western Finance Association,2021,Shared Culture and Technological Innovation: Evidence from Corporate R&D Teams,Tristan Fitzgerald; Xiaoding Liu
Western Finance Association,2021,"In the Red: Overdrafts, Payday Lending and the Underbanked",Emily Williams; Marco Di Maggio; Angela Ma
Western Finance Association,2021,Salience and Households’ Flood Insurance Decisions,Zhongchen Hu
Western Finance Association,2021,Reference Points in Refinancing Decisions,Virginia Gianinazzi
Western Finance Association,2021,Concealed Carry,Spencer Andrews; Riccardo Colacito; Mariano Croce; Federico Gavazzoni
Western Finance Association,2021,Pricing Currency Risks,Mikhail Chernov; Magnus Dahlquist; Lars A. Lochstoer
Western Finance Association,2021,Currency Management by International Fixed Income Mutual Funds,Clemens Sialm; Qifei Zhu
Western Finance Association,2021,"Global Capital and Local Assets: House Prices, Quantities, and Elasticities",Caitlin Gorback; Benjamin J. Keys
Western Finance Association,2021,House Price Contagion and U.S. City Migration Networks,Gregor Schubert
Western Finance Association,2021,Partisan Residential Sorting on Climate Change Risk,Asaf Bernstein; Stephen Billings; Matthew Gustafson; Ryan Lewis
Western Finance Association,2021,Corporate Taxes and Retail Prices,Scott R. Baker; Stephen Teng Sun; Constantine Yannelis
Western Finance Association,2021,"Higher Dividend Taxes, No Problem! Evidence from Taxing Entrepreneurs in France",Adrien Matray; Charles Boissel
Western Finance Association,2021,Are Bankruptcy Professional Fees Excessively High?,Samuel Antill
Western Finance Association,2021,Optimal Macroprudential Policy and Asset Price Bubbles,Nina Biljanovska; Lucyna Anna Gornicka; Alexandros Vardoulakis
Western Finance Association,2021,Distrust in Experts and the Origins of Disagreement,Ing-Haw Cheng; Alice Hsiaw
Western Finance Association,2021,Testing the Local Martingale Theory of Bubbles using Cryptocurrencies,Soon Hyeok Choi; Robert Jarrow
Western Finance Association,2021,Corporate Hiring under Covid-19,Murillo Campello; Gaurav Kankanhalli; Pradeep Muthukrishnan
Western Finance Association,2021,Firm Finances and the Spread of COVID-19: Evidence from Nursing Homes,Taylor Begley; Daniel Weagley
Western Finance Association,2021,"Reshaping the Local Marketplace: Financing, Independent Businesses, Large Firms, and COVID",Vojislav Maksimovic; Liu Yang
Western Finance Association,2021,Monetary Policy Transmission in Segmented Markets,Jens Eisenschmidt; Yiming Ma; Anthony Lee Zhang
Western Finance Association,2021,Heterogeneous Global Cycles,Maryam Farboodi; Peter Kondor
Western Finance Association,2021,Sovereign Default and the Decline in Interest Rates,Max Miller
Western Finance Association,2021,Internal and External Financing,James Paron; Jessica Wachter
Western Finance Association,2021,Stealth Acquisitions and Product Market Competition,Gerard T. Hoberg
Western Finance Association,2021,Segmented Going-Public Markets and the Demand for SPACs,John Kepler; Vic Naiker; Christopher Stewart
Western Finance Association,2021,Shrinking Boundary of the Invisible Hand,Jessica Bai; Angela Ma; Miles Zheng
Western Finance Association,2021,Fragile Liquidity,Dan Su
Western Finance Association,2021,Sophisticated and Unsophisticated Runs,Allaudeen Hameed
Western Finance Association,2021,Institutional Brokerage Networks: Facilitating Liquidity Provision,Tim Park
Western Finance Association,2021,Do Mortgage Lenders Compete Locally? Evidence Beyond Interest Rates,Marco Cipriani; Gabriele La Spada
Western Finance Association,2021,Inefﬁcient Regulation: Mortgages versus Total Credit,Andra Ghent
Western Finance Association,2021,The Mortgage Piggy Bank: Building Wealth through Amortization,Greg Buchak; Adam Jorring
Western Finance Association,2021,Shale Shocked: Cash Windfalls and Household Debt Repayment,Artashes Karapetyan; Jens Kvaerner; Maximilian Rohrer
Western Finance Association,2021,"Income Inequality, Debt Burden and COVID-19",Asaf Bernstein; Peter Koudijs
Western Finance Association,2021,Financial Media as a Money Doctor: Evidence from Reﬁnancing Decisions,Sumit Agarwal; J. Anthony Cookson; Erik Gilje; Rawley Heimer
Western Finance Association,2021,Does the Federal Reserve Obtain Competitive and Appropriate Prices in Monetary Policy Implementations?,Deeksha Gupta; Tetiana Davydiuk
Western Finance Association,2021,(Why) Do Central Banks Care About Their Proﬁts?,Lin Hu; Kun Li; Phong Ngo; Denis Sosyura
Western Finance Association,2021,Bank Stress Tests and Consumer Credit Markets: Credit and Real Impacts,Yu An; Zhaogang Song
Western Finance Association,2021,Information Premium and Macro Dynamics,Igor Goncharov; Vasso Ioannidou; Martin Schmalz
Western Finance Association,2021,Is The United States A Lucky Survivor: A Hierarchical Bayesian Approach,Hengjie Ai; Ravi Bansal; Jay Im; Chao Ying
Western Finance Association,2021,"Democratization, Inequality, and Risk Premia",Jules Van Binsbergen; Sophia Hua; Jessica Wachter
Western Finance Association,2021,Dissecting Mechanisms of Financial Crises: Intermediation and Sentiment,Max Miller
Western Finance Association,2021,A Macro-Finance Model with Sentiment,Arvind Krishnamurthy; Wenhao Li
Western Finance Association,2021,Financial Fragility with Collateral Circulation,Peter Maxted
Western Finance Association,2021,"Intermediated Asymmetric Information, Compensation, and Career Prospects",Cyril Monnet; Vincent Maurin; Piero Gottardi
Western Finance Association,2021,CEO Pet Projects,Dmitry Orlov; Ron Kaniel
Western Finance Association,2021,Executive Compensation: The Trend Toward One Size Fits All,Paul Décaire; Denis Sosyura
Western Finance Association,2021,Hedge Fund Performance under Misspeciﬁed Models,Felipe Cabezon
Western Finance Association,2021,The Hedge Fund Industry is Bigger (and Has Performed Better) Than You Think,David Ardia; Laurent Barras; Patrick Gagliardini; Olivier Scaillet
Western Finance Association,2021,Rush to Raise: Does Fundraising Pressure Incentivise Strategic Venture Capital Deal Pricing?,Daniel J. Barth; Mikko Kauppila; Juha Joenvaara; Russ Wermers
Western Finance Association,2021,Does Size Matter? The Real Effects of Subsidizing Small Firms,Peter Kien Pham; Nicholas Turner; Jason Zein
Western Finance Association,2021,Job Growth from Opportunity Zones,Matthew Denes; Ran Duchin; John Hackney
Western Finance Association,2021,Employment Effects of Alleviating Financing Frictions: Worker-level Evidence from a Loan Guarantee Program,Alina Arefeva; Morris Davis; Andra Ghent; Minseon Park
Western Finance Association,2019,"The WFA seeks to provide a safe, inclusive and productive meeting environment that fosters the exchange of scientiﬁc ideas, provides equal opportunities and treatment for all participants, and is free from discrimination and harassment.",
Western Finance Association,2022,"Submission of papers: Papers should be submitted electronically at the WFA web site, https://westernﬁnance.org, which will contain full instructions for submission, including required on-line registration, creation of the required cover page, the submission fee, and other vital instructions. We will begin taking submissions on or about October 1, 2021. The deadline for submissions is midnight PST, November 18, 2021. Papers will be reviewed anonymously by up to three members of the Program Committee, and authors will be notiﬁed of the Program Committee’s decisions by the end of March, 2022.",
Western Finance Association,2021,"The USC Marshall School of Business Trefftzs Award of $5,000 for the best student paper.",
Western Finance Association,2021,"Charles River Associates Award of $5,000 for the best paper on corporate ﬁnance.",
Western Finance Association,2021,"Elsevier Sponsored Award of $5,000 for the best paper on ﬁnancial institutions.",
Western Finance Association,2021,"PBCSF Award of $5,000 for the best paper in ﬁntech",
Western Finance Association,2021,"NASDAQ Award of $5,000 for the best paper on asset pricing.",
Western Finance Association,2021,"Two Sigma Award of $5,000 for the best paper on Investment Management.",
Western Finance Association,2021,"Wharton School – WRDS Award of $5,000 for the best empirical ﬁnance paper.",
Western Finance Association,2022,"Investor Demand, Financial Market Power, and Capital Misallocation",Jonathan Berk; Jaewon Choi; Mahyar Kargar; Xu Tian; Yufeng Wu
Western Finance Association,2022,Learning about the Consumption Risk Exposure of Firms,Yongjin Kim; Lars-Alexander Kuehn; Kai Li
Western Finance Association,2022,Feedback Effects with Risk Aversion: An Application to Climate Risk,Snehal Banerjee; Bradyn Breon-Drish; Kevin Smith
Western Finance Association,2022,Intermediary-Based Loan Pricing,Mitchell A. Petersen; Pierre Mabille; Olivier Wang
Western Finance Association,2022,Credit Fire Sales: Captive Lending as Liquidity in Distress,Matteo Benetton; Sergio Mayordomo; Daniel Paravisini
Western Finance Association,2022,"Loan Guarantees, Bank Lending and Credit Risk Reallocation",Andrew Ellul; Carlo Altavilla; Marco Pagano; Andrea Polo; Thomas Vlassopoulos
Western Finance Association,2022,Impact Investing and Venture Capital Industry: Experimental Evidence,Ayako Yasuda; Ye Zhang
Western Finance Association,2022,Are Carbon Emissions Associated with Stock Returns ?,Jitendra Aswani; Shivaram Rajgopal; Aneesh Raghunandan
Western Finance Association,2022,Fresh Start or Fresh Water: The Impact of Environmental Lender Liability,Aymeric Bellon
Western Finance Association,2022,Making Money,Ye Li
Western Finance Association,2022,Digital Currency Runs,Gary Gorton; Chase Ross; Sharon Ross; David Skeie
Western Finance Association,2022,Inflation and Individual Investors' Behavior: Evidence from the German Hyperinflation,Fabio Braggion; Felix von Meyerinck; Nic Schaub
Western Finance Association,2022,Bond Convenience Yields in the Eurozone Currency Union,Robert Goldstein; Zhengyang Jiang; Hanno Lustig; Stijn Van Nieuwerburgh; Mindy Z. Xiaolan
Western Finance Association,2022,Issuance and Valuation of Corporate Bonds with Quantitative Easing,Stefano Pegoraro; Mattia Montagna
Western Finance Association,2022,Risk-Free Rates and Convenience Yields Around the World,William Diamond; Peter Van Tassel
Western Finance Association,2022,Non-Standard Errors,Mikhail Chernov; Albert Menkveld; Anna Dreber; Felix Holzmeister; Juergen Huber; Magnus Johannesson
Western Finance Association,2022,Asset Pricing with Panel Tree under Global Split Criteria,Will Cong; Guanhao Feng; Jingyu He; Xin He
Western Finance Association,2022,Semiparametric Conditional Factor Models: Estimation and Inference,Qihui Chen; Nick Roussanov; Xiaoliang Wang
Western Finance Association,2022,"Global Sales, International Currencies and the Currency Denomination of Debt",Lars A. Lochstoer; Riccardo Colacito; Yan Qian; Andreas Stathopoulos
Western Finance Association,2022,How Can Asset Prices Value Exchange Rate Wedges?,Edith Liu; Karen Lewis
Western Finance Association,2022,International Trade and the Risk in Bilateral Exchange Rates,Ramin Hassan; Erik Loualiche; Alexandre R. Pecora; Colin Ward
Western Finance Association,2022,Flow Trading,Liyan Yang; Eric Budish; Peter Cramton; Albert Kyle; Jeongmin Lee; David Malec
Western Finance Association,2022,On the Effects of Continuous Trading,Ivan Indriawan; Roberto Pascual; Andriy Shkilko
Western Finance Association,2022,Risk Sharing in Time Priority Markets,Corey Garriott; Vincent van Kervel; Marius Zoican
Western Finance Association,2022,Crowding and Factor Returns,Nicolae Gârleanu; Wenjin Kang; K Geert Rouwenhorst; Ke Tang
Western Finance Association,2022,Investor Betas,Ryan Lewis; Shrihari Santosh
Western Finance Association,2022,Test Assets and Weak Factors,Stefano Giglio; Dacheng Xiu; Dake Zhang
Western Finance Association,2022,Constrained-Efficient Capital Reallocation,S. Abraham (Avri) Ravid; Andrea Lanteri; Adriano A. Rampini
Western Finance Association,2022,Credit Risk and the Life Cycle of Callable Bonds: Implications for Real Corporate Decisions,Bo Becker; Murillo Campello; Viktor Thell; Dong Yan
Western Finance Association,2022,Creating Controversy in Proxy Voting Advice,Andrey Malenko; Nadya Malenko; Chester S. Spatt
Western Finance Association,2022,Unpacking the Black Box: Regulating Algorithmic Decisions,Elena N. Asparouhova; Laura Blattner; Scott T. Nelson; Jann Spiess
Western Finance Association,2022,Does Floor Trading Matter?,Jonathan Brogaard; Matthew C. Ringgenberg; Dominik Rosch
Western Finance Association,2022,Financial Regulation and Automation Adoption: Evidence from Stock Trading Firms,Pedro Tremacoldi-Rossi
Western Finance Association,2022,"Cheapest-to-Deliver Pricing, Optimal MBS Securitization, and Market Quality",Barney Hartman-Glaser; Yesol Huh; You Suk Kim
Western Finance Association,2022,SPAC IPOs and Sponsor Network Centrality,Chen Lin; Fangzhou Lu; Roni Michaely; Shihua Qin
Western Finance Association,2022,Agency Conflicts in Securitization: Evidence from Ginnie Mae Early Buyouts,Arka Prava Bandyopadhyay
Western Finance Association,2022,A Portfolio Approach to Global Imbalances,Burton Hollifield; Zhengyang Jiang; Robert Richmond; Tony Zhang
Western Finance Association,2022,Beyond Incomplete Spanning: Convenience Yields and Exchange Rate Disconnect,Zhengyang Jiang; Arvind Krishnamurthy; Hanno Lustig; Jialu Sun
Western Finance Association,2022,"US Global Shock Exposures, Recursive Preferences and International Asset Pricing",Sun Yong Kim
Western Finance Association,2022,"How Competitive is the Stock Market? Theory, Evidence from Portfolios, and Implications for the Rise of Passive Investing",Joel Hasbrouck; Valentin Haddad; Paul Huebner; Erik Loualiche
Western Finance Association,2022,Trading Fees and Intermarket Competition,Marios Panayides; Barbara Rindi; Ingrid M. Werner
Western Finance Association,2022,Quote Competition in Corporate Bonds,Terrence Hendershott; Dan Li; Dmitry Livdan; Norman Schürhoff; Kumar Venkataraman
Western Finance Association,2022,What Drives Investors' Portfolio Choices? Separating Risk Preferences from Frictions,Michaela Pagel; Taha Choukhmane; Tim de Silva
Western Finance Association,2022,Disposed to Be Overconfident,Katrin Gödker; Terrance Odean
Western Finance Association,2022,The Mortgage-Cash Premium Puzzle,Michael Reher; Rossen Valkanov
Western Finance Association,2022,The Epidemiology of Financial Constraints,Yuri Tserlukevich
Western Finance Association,2022,Segmented Arbitrage,Ioannis Spyridopoulos; Morad Zekhnini; William Grieser
Western Finance Association,2022,"Capital Quality, Productivity, and Financial Constraints: Evidence from India",Emil Siriwardane; Aditya Sunderam; Jonathan Wallen
Western Finance Association,2022,Green Image in Supply Chains: Selective Disclosure of Corporate Suppliers,Poorya Kabir; Seyed Mohammad Mansouri
Western Finance Association,2022,The Impact of Impact Investing,Yilin Shi; Jing Wu; Yu Zhang
Western Finance Association,2022,Exit vs. Voice,Jonathan Berk; Jules Van Binsbergen
Western Finance Association,2022,Crowded Ratings: Clientele Effects in the Corporate Bond Market,Eleonora Broccardo; Oliver Hart; Luigi Zingales
Western Finance Association,2022,Public Employee Pensions and Municipal Insolvency,Naveen Khanna; Francisco Gomes; Ryan Lewis; Jordan Nickerson
Western Finance Association,2022,Bank Loan Funds: Discretionary Values as a Source of Stability,Sean Myers
Western Finance Association,2022,"Demand Elasticities, Nominal Rigidities and Asset Prices",Mustafa Emin; Christopher M. James
Western Finance Association,2022,Price Rigidities and Credit Risk,Nuno Clara
Western Finance Association,2022,Technology-Skill Complementarity and Labor Displacement: Evidence from Linking Two Centuries of Patents with Occupations,Patrick Augustin; Francis Cong; Alexandre Corhay; Michael Weber
Western Finance Association,2022,Let the Worst One Fail: A Credible Solution to the Too-Big-To-Fail Conundrum,Leonid Kogan; Dimitris Papanikolaou; Lawrence D. W. Schmidt; Bryan Seegmiller
Western Finance Association,2022,Population Aging and Bank Risk-Taking,Thomas Philippon; Olivier Wang
Western Finance Association,2022,Bank Consolidation and Uniform Pricing,Sebastian Doerr; Gazi Kaba¸s; Steven Ongena
Western Finance Association,2022,What Drives Variation in the U.S. Debt/Output Ratio? The Dogs that Didn’t Bark,Joao Granja; Nuno Paixao
Western Finance Association,2022,Government Debt Management and Inﬂation with Real and Nominal Bonds,Zhengyang Jiang; Hanno Lustig; Stijn Van Nieuwerburgh; Mindy Z. Xiaolan
Western Finance Association,2022,The Debt Capacity of a Government,Alessandro Villa; Vytautas Valaitis; Lukas Schmid
Western Finance Association,2022,Information-Driven Volatility,Bernard Dumas; Paul Ehling; Chunyu Yang
Western Finance Association,2022,Three Common Factors,Hengjie Ai; Leyla Jianyu Han; Lai Xu
Western Finance Association,2022,Extrapolative Market Participation,Elena Andreou; Patrick Gagliardini; Eric Ghysels; Mirco Rubin
Western Finance Association,2022,Raising Capital from Investor Syndicates with Strategic Communication,Wanbin Pan; Zhiwei Su; Huijun Wang; Jianfeng Yu
Western Finance Association,2022,Reputation Spillovers in Venture Capital: Evidence from a Randomized Field Experiment,Dan Luo
Western Finance Association,2022,Strategic Learning and Corporate Investment,Shai Bernstein; Kunal Mehta; Richard Townsend; Ting Xu
Western Finance Association,2022,Uninformed but Predictable: Corporate Trading and Price Discovery in Over-the-counter FX Markets,Paul Décaire; Michael D. Wittry
Western Finance Association,2022,The Value of Off-Exchange Data,Umang Khetan; Petra Sinagl
Western Finance Association,2022,Spooﬁng in Equilibrium,Thomas Ernst; Jonathan Sokobin; Chester S. Spatt
Western Finance Association,2022,Reserves Were Not So Ample After All,Basil Williams; Andrzej Skrzypacz
Western Finance Association,2022,"Central Bank Communication Choices: Adverse Selection, Volatility and Liquidity in a Market With Fast and Slow Traders",Adam Copeland; Darrell Dufﬁe; Yilin (David) Yang
Western Finance Association,2022,What Quantity of Reserves Is Sufﬁcient?,Hedi Benamar; Clara Vega; Alain Chaboud
Western Finance Association,2022,CEO Compensation: Evidence From the Field,Yilin (David) Yang
Western Finance Association,2022,The Short-Termism Trap: Competition for Informed Investors under Stock-Based CEO Compensation,Alex Edmans; Tom Gosling; Dirk Jenter
Western Finance Association,2022,Regulating CEO Pay: Evidence from the Nonproﬁt Revitalization Act,James Dow; Jungsuk Han; Francesco Sangiorgi
Western Finance Association,2022,The Market Inside the Market: Odd-lot Quotes,Ilona Babenko; Benjamin Bennett; Rik Sen
Western Finance Association,2022,"High-Frequency Trading, For-Proﬁt Exchanges, and Endogenous Delays",Robert Bartlett; Justin McCreary; Maureen O’Hara
Western Finance Association,2022,Competition and Exchange Data Fees,Jun Aoyagi
