conference,year,title,authors
European Finance Association,2021,Bank Liquidity Provision Across the Firm Size Distribution,Gabriel Chodorow Reich; Olivier Darmouni; Stephan Luck; Matt Plosser
European Finance Association,2021,Are Repo Markets Fragile? Evidence from September 2019,Alyssa Anderson; Sriya Anbil; Zeynep Senyuz
European Finance Association,2021,Dissecting Mechanisms of Financial Crises: Intermediation and Sentiment,Arvind Krishnamurthy; Wenhao Li
European Finance Association,2021,Bond Convenience Yields in the Eurozone Currency Union,Zhengyang Jiang; Hanno Lustig; Stijn Van Nieuwerburgh; Mindy Xiaolan
European Finance Association,2021,Mutual Fund Risk Shifting and Risk Anomalies,Xiao Han; Nikolai Roussanov; Hongxun Ruan
European Finance Association,2021,Banning Dark Pools: Venue Selection and Investor Trading Costs,Christian Neumeier; Arie Gozluklu; Peter Hoffmann; Peter O’Neill; Felix Suntheim
European Finance Association,2021,Information Acquisition and the Pre-Announcement Drift,Hengjie Ai; Ravi Bansal; Leyla Jianyu Han
European Finance Association,2021,Small Bank Financing and Funding Hesitancy in a Crisis: Evidence from the Paycheck Protection Program,Tetyana Balyuk; Nagpurnanand Prabhala; Manju Puri
European Finance Association,2021,Safe Asset Carry Trade,Benedikt Ballensiefen; Angelo Ranaldo
European Finance Association,2021,Discontinued Positive Feedback Trading and the Decline of Momentum Profitability,Andrea Rossi; Itzhak Ben-David; Jiacui Li; Yang Song
European Finance Association,2021,High-Frequency Traders and Single-Dealer Platforms,Fatemeh Aramian; Lars L. Nordén
European Finance Association,2021,The Pre-FOMC Announcement Drift and Private Information: Kyle Meets Macro-Finance,Chao Ying
European Finance Association,2021,Dissecting the Effect of Financial Constraints on Small Firms,Su Wang; Juanita González-Uribe
European Finance Association,2021,The term structure of CIP violations,Patrick Augustin; Mikhail Chernov; Lukas Schmid; Dongho Song
European Finance Association,2021,Benchmarking Intensity,Anna Pavlova; Taisiya Sikorskaya
European Finance Association,2021,The Tradeoff between Discrete Pricing and Discrete Quantities: Evidence from U.S.-listed Firms,Sida Li; Mao Ye
European Finance Association,2021,The Voice of Monetary Policy,Yuriy Gorodnichenko; Tho Pham; Oleksandr Talavera
European Finance Association,2021,Does Private Equity Investment in Healthcare Benefit Patients? Evidence from Nursing Homes,Atul Gupta; Sabrina Howell; Constantine Yannelis; Abhinav Gupta
European Finance Association,2021,Regulatory Sandboxes and Fintech Funding: Evidence from the UK,Giulio Cornelli; Sebastian Doerr; Leonardo Gambacorta; Ouarda Merrouche
European Finance Association,2021,Ownership and Competition,Alessio Piccolo; Jan Schneemeier
European Finance Association,2021,The Gender Gap in Household Bargaining Power: A Portfolio-Choice Approach,Ran Gu; Cameron Peng
European Finance Association,2021,FinTech Lending and Cashless Payments,Pulak Ghosh; Boris Vallee; Yao Zeng
European Finance Association,2021,Financing and Resolving Banking Groups,Albert Banal-Estanol; Julian Kolm; Gyöngyi Lóránth
European Finance Association,2021,"Skilled Labor Rationing, Hiring Uncertainty, and Corporate Investment: Evidence from H-1B Visa Application Deadlines",Sheng-Jun Xu
European Finance Association,2021,Rents and Intangibles: a Q+ framework,Nicolas Crouzet; Janice Eberly
European Finance Association,2021,Financial Literacy in the Age of Green Investment,Anders Anderson; David T. Robinson
European Finance Association,2021,The Value of “New” and “Old” Intermediation in Online Debt Crowdfunding,Alberto Manconi; Fabio Braggion; Nicola Pavanini; Haikun Zhu
European Finance Association,2021,Green Capital Requirements,Martin Oehmke; Marcus Opp
European Finance Association,2021,Information Disclosure and Drug Development: Evidence from Mandatory Reporting of Clinical Trials,Po-Hsuan Hsu; Kyungran Lee; Katie Moon; Seungjoon Oh
European Finance Association,2021,Shelving or developing? The acquisition of potential competitors under financial constraints,Chiara Fumagalli; Massimo Motta; Emanuele Tarantino
European Finance Association,2021,Human Capital Risk and Portfolio Choices: Evidence from University Admission Discontinuities,Philippe d’Astous; Stephen Shore
European Finance Association,2021,Data vs collateral,Leonardo Gambacorta; Yiping Huang; Zhenhua Li; Han Qiu; Shu Chen
European Finance Association,2021,Intraday Liquidity and Money Market Dislocations,Adrien d’Avernas; Quentin Vandeweyer
European Finance Association,2021,48th EFA Annual Meeting,
European Finance Association,2022,49th EFA Annual Meeting,
European Finance Association,2022,Subjective Risk and Return,Theis Ingerslev Jensen
European Finance Association,2022,"Stay or Sell? Divestment, Activism and Corporate Social Responsibility",Victor Antoine Saint-Jean
European Finance Association,2022,Politically Polarized Depositors,Jinoug Jeung
European Finance Association,2022,To treat or prevent pollution?,Caroline Gentet-Raskopf
European Finance Association,2022,Creditor Control of Environmental Activity: The Role of Liquidation Value,Jason (Pang-Li) Chen
European Finance Association,2022,The Adoption of Artificial Intelligence by Venture Capitalists,Maxime Bonelli
European Finance Association,2022,Blockholder and CEO Wealth-Performance Sensitivity,Sheng Huang
European Finance Association,2022,The Human Capital Reallocation of M&A: Inventor-level Evidence,Luxi Wang
European Finance Association,2022,Hidden Alpha,Manuel Ammann; Alexander Cochardt; Lauren Cohen; Stephan Heller
European Finance Association,2022,Is There a Macro-Announcement Premium?,Mohammad Ghaderi; Sang Byung Seo
European Finance Association,2022,The Optimal Design of Green Securities,Adelina Barbalau; Federica Zeni
European Finance Association,2022,Scale or Yield? A Present-Value Identity,Thummim Cho; Lukas Kremens; Dongryeol Lee; Christopher Polk
European Finance Association,2022,The Social Media Risk Premium,Amin Hosseini; Gergana Jostova; Alexander Philipov; Robert Savickas
European Finance Association,2022,Caught by Surprise: How Markets Respond to Macroeconomic News,Guido Baltussen; Amar Soebhag
European Finance Association,2022,"Environmental regulatory risks, firm pollution, and mutual funds’ portfolio choices",Simon Xu
European Finance Association,2022,New versus Old Sorts and Stocks: Implications for Asset Pricing,Martijn Boons; Fahiz Baba-Yara; Andrea Tamoni
European Finance Association,2022,Using Social Media to Identify the Effects of Congressional Viewpoints on Asset Prices,Francesco Bianchi; Roberto Gomez Cram; Howard Kung
European Finance Association,2022,What do Bond Investors Learn from Macroeconomic News?,Bruno Feunou; Jean-Sebastien Fontaine; Guillaume Roussellet
European Finance Association,2022,Banking on Carbon: Corporate Lending and Cap-and-Trade Policy,Ivan Ivanov; Mathias Kruttli; Sumudu Watugala
European Finance Association,2022,Missing Data in Asset Pricing Panels,JJoachim Freyberger; Bjoern Hoeppner; Andy Neuhierl; Michael Weber
European Finance Association,2022,Gender Bias in Promotions: Evidence from Financial Institutions,Ruidi Huang; Erik Mayer; Darius Miller
European Finance Association,2022,Innovation: The Bright Side of Common Ownership?,Mireia Giné; Miguel Anton; Martin Schmalz; Florian Ederer
European Finance Association,2022,Real Effects of Centralized Markets: Evidence from Steel Futures,Thorsten Martin
European Finance Association,2022,Credit Market Equivalents and the Valuation of Private Firms,Niklas Huether; Lukas Schmid; Roberto Steri
European Finance Association,2022,Bank Credit and Money Creation on Payment Networks: A Structural Analysis of Externalities and Key Players,Ye Li; Yi Li; Huijun Sun
European Finance Association,2022,Potential and the Gender Gap in Promotions,Alan Benson; Danielle Li; Kelly Shue
European Finance Association,2022,Specialized Investments and Firms’ Boundaries: Evidence from Textual Analysis of Patents,Jan Bena; Isil Erel; Daisy Wang; Michael Weisbach
European Finance Association,2022,"Artificial Intelligence, Firm Growth, and Product Innovation",Tania Babina; Anastassia Fedyk; Alex He; James Hodson
European Finance Association,2022,The Value of Privacy and the Choice of Limited Partners by Venture Capitalists,Rustam Abuzov; Will Gornall; Ilya Strebulaev
European Finance Association,2022,Money Illiquidity,Dmitry Livdan; Norman Schuerhoff; Vladimir Sokolov
European Finance Association,2022,Owner Culture and Pay Inequality within Firms,Iris Wang; Jan Bena; Guangli Lu
European Finance Association,2022,100 Years of Rising Corporate Concentration,Spencer Kwon; Yueran Ma; Kaspar Zimmermann
European Finance Association,2022,Consumer Privacy and Value of Consumer Data,Mehmet Canayaz; Ilja Kantorovitch; Roxana Mihet
European Finance Association,2022,Corporate Venture Capital and Firm Scope,Yifei Zhang
European Finance Association,2022,On the Rise of Payment Firms,Tobias Berg; Valentin Burg; Jan Keil; Manju Puri
European Finance Association,2022,"How Competitive is the Stock Market? Theory, Evidence from Portfolios, and Implications for the Rise of Passive Investing",Valentin Haddad; Paul Huebner; Erik Loualiche
European Finance Association,2022,The Debt Capacity of a Government,Bernard Dumas; Paul Ehling; Chunyu Yang
European Finance Association,2022,"Executive Labor Market Frictions, Corporate Bankruptcy and CEO Careers",Morten Grindaker; Andreas Kostøl; Kasper Roszbach
European Finance Association,2022,A Long and a Short Leg Make For a Wobbly Equilibrium,Nicolae Garleanu; Stavros Panageas; Geoffery Zheng
European Finance Association,2022,Pricing and Constructing International Government Bond Portfolios,Otto Randl; Giorgia Simion; Josef Zechner
European Finance Association,2022,What Drives Variation in the U.S. Debt/Output Ratio? The Dogs that Didn’t Bark,Zhengyang Jiang; Hanno Lustig; Stijn Van Nieuwerburgh; Mindy Xiaolan
European Finance Association,2022,Can the cure kill the patient? Corporate credit interventions and debt overhang,Fabrice Tourre; Nicolas Crouzet
European Finance Association,2022,"Two Investors, Two Trees, Two Goods",Maxime Sauzet
European Finance Association,2022,Index-Linked Trading and Stock Returns,Shaun Davies
European Finance Association,2022,Can Monetary Policy Create Fiscal Capacity?,Vadim Elenev; Tim Landvoigt; Patrick Shultz; Stijn Van Nieuwerburgh
European Finance Association,2022,Supporting small firms through recessions and recoveries,Diana Bonfim; Cláudia Custódio; Clara Raposo
European Finance Association,2022,Cooling Auction Fever: Evidence from the Housing Market,Antonio Gargano; Marco Giacoletti
European Finance Association,2022,JAQ of All Trades: Job Mismatch and Firm Productivity,Luca Coraggio; Marco Pagano; Annalisa Scognamiglio; Joacim Tåg
European Finance Association,2022,Mergers under the Microscope: Analyzing Conference Call Transcripts,Sudipto Dasgupta; Jarrad Harford; Fangyuan Ma; Daisy Wang; Haojun Xie
European Finance Association,2022,Patient VCs vs. Deep-Pocketed Incumbents: VC Financing Strategies in the Presence of Competitive Threats,Roham Rezaei; Jason Zein; Peter Pham
European Finance Association,2022,The Carrot and the Stick: Bank Bailouts and the Disciplining Role of Board Appointments,CChristian Mücke; Loriana Pelizzon; Vincenzo Pezone; Anjan Thakor
European Finance Association,2022,"Environmental Activism, Endogenous Risk, and Stock Prices",Ravi Jagannathan; Soohun Kim; Robert McDonald; Shixiang Xia
European Finance Association,2022,Do Employees Cheer for Private Equity? The Heterogeneous Effects of Buyouts on Job Quality,Will Gornall; Oleg Gredil; Sabrina Howell; Xing Liu; Jason Sockin
European Finance Association,2022,Do Health Hazards Shape Firm Boundaries?,Adrian Lam
European Finance Association,2022,"Mapping U.S.-China Technology Decoupling, Innovation, and Firm Performance",Pengfei Han; Wei Jiang; Danqing Mei
European Finance Association,2022,Mixing QE and Interest Rate Policies at the Effective Lower Bound: Micro Evidence from the Euro Area,Christian Bittner; Alexander Rodnyansky; Farzad Saidi; Yannick Timmer
European Finance Association,2022,Dissecting Green Returns,Lubos Pastor; Robert Stambaugh; Lucian Taylor
European Finance Association,2022,Which workers suffer (or benefit) from firm-level uncertainty shocks?,Andrea Caggese; Vicente Cunat; Daniel Metzger
European Finance Association,2022,Intellectual Property Protection Lost: The Impact on Competition and Acquisitions,Utku Acikalin; Tolga Caskurlu; Gerard Hoberg; Gordon Phillips
European Finance Association,2022,"Political Power-Sharing, Firm Entry, and Economic Growth: Evidence from Multiple Elected Representatives",Harsha Dutta; Pulak Ghosh; Arkodipta Sarkar; Nishant Vats
European Finance Association,2022,Exorbitant Privilege? Quantitative Easing and the Bond Market Subsidy of Prospective Fallen Angels,Viral V. Acharya; Ryan Banerjee; Matteo Crosignani; Tim Eisert; Renee Spigt
European Finance Association,2022,The Pace of Change: Socially Responsible Investing in Private Markets,Deeksha Gupta; Alexandr Kopytov; Jan Starmans
European Finance Association,2022,The Loan Fee Anomaly: A Short Seller’s Best Ideas,Joseph Engelberg; Richard Evans; Greg Leonard; Adam Reed; Matthew Ringgenberg
European Finance Association,2022,Currency Network Risk,Mariassunta Giannetti; Chotibhak Jotikasthira
European Finance Association,2022,Bond Price Fragility and the Structure of the Mutual Fund Industry,Mariassunta Giannetti; Chotibhak Jotikasthira
European Finance Association,2022,Life Expectancy and Corporate Debt Markets,Zhanhui Chen; Vidhan Goyal; Pingyi Lou; Wenjun Zhu
European Finance Association,2022,"Textual Analysis of Short-seller Research Reports, Stock Prices, and Real Investment",Jules H. van Binsbergen; Xiao Han; Alejandro Lopez Lira
European Finance Association,2022,Benchmark Currency Stochastic Discount Factors,Piotr Orlowski; Valeri Sokolovski; Erik Sverdrup
European Finance Association,2022,Nonbank Lenders as Global Shock Absorbers: Evidence from US Monetary Policy Spillovers,David Elliott; Ralf Meisenzahl; Jose-Luis Peydro
European Finance Association,2022,Treasury Bill Shortages and the Pricing of Short-Term Assets,Quentin Vandeweyer; Adrien d’Avernas
European Finance Association,2022,"When Brokerages Restrict Retail Investors, Does the Game Stop?",Charles M. Jones; Adam V. Reed; William Waller
European Finance Association,2022,Foreign Exchange Fixings and Returns Around the Clock,Ingomar Krohn; Philippe Mueller; Paul Whelan
European Finance Association,2022,"Counterparty Choice, Bank Interconnectedness, and Systemic Risk",Dasol Kim; Andrew Ellul
European Finance Association,2022,Price pressure during central bank asset purchases: Evidence from the covered bond market,Philipp Lentner
European Finance Association,2022,Place-Based Policies and the Geography of Corporate Investment,Cameron LaPoint; Shogo Sakabe
European Finance Association,2022,What Drives the Finance Academia Wage Premium?,Claire Célérier; Boris Vallée; Alexey Vasilenko
European Finance Association,2022,"The optics of corporate governance: External stakeholders, information environments, and reputation sustainability",Thomas Noe; Michael Rebello; Thomas Rietz
European Finance Association,2022,Expectations and Bank Lending,Teodora Paligorova; Jose-Luis Peydro; Yueran Ma
European Finance Association,2022,Trade uncertainty and U.S. bank lending,Ricardo Correa; Julian di Giovanni; Linda Goldberg; Camelia Minoiu
European Finance Association,2022,Investing with the Government: A Field Experiment in China,Emanuele Colonnelli
European Finance Association,2022,Post-merger Restructuring of the Labor Force,Britta Gehrke; Ernst Maug; Stefan Obernberger; Christoph Schneider
European Finance Association,2022,The Short-Termism Trap: Competition for Informed Investors under Stock-Based CEO Compensation,James Dow; Jungsuk Han; Francesco Sangiorgi
European Finance Association,2022,"Bank Funding Risk, Reference Rates, and Credit Supply",Stephan Luck; Darrell Duffie; Harry Cooperman; Zachry Wang
European Finance Association,2022,Sharing the Burden Equally? Intra-Group Effects of Bank Capital Requirements,Hans Degryse; Mike Mariathasan; Carola Theunisz
European Finance Association,2022,The Effect of Tax Incentives on Local Private Investments and Entrepreneurship: Evidence from the Tax Cuts and Jobs Act of 2017,Jiajie Xu
European Finance Association,2022,Impact of Money in Politics on Labor and Capital: Evidence from Citizens United v. FEC,Pat Akey; Tania Babina; Gregory Buchak; Ana-Maria Tenekedjieva
European Finance Association,2022,Robust Corporate Signaling with Heterogeneous Beliefs,Thomas Rivera
European Finance Association,2022,Survival of the Biggest: Large Banks and Crises since 1870,Matthew Baron; Moritz Schularick; Kaspar Zimmermann
European Finance Association,2022,Political Ideology and International Capital Allocation,Elisabeth Kempf; Mancy Luo; Larissa Schaefer; Margarita Tsoutsoura
European Finance Association,2022,Institutional Corporate Bond Pricing,Lorenzo Bretscher; Lukas Schmid; Ishita Sen; Varun Sharma
European Finance Association,2022,Investor Betas,Ryan Lewis; Shrihari Santosh
European Finance Association,2022,How Does Climate Change Affect Firm Sales? Identifying Supply Effects,Claudia Custodio; Miguel Ferreira; Emilia Garcia-Appendini; Adrian Lam
European Finance Association,2022,"A Preferred-Habitat Model of Term Premia, Exchange Rates and Monetary Policy Spillovers",Pierre-Olivier Gourinchas; Walker Ray; Dimitri Vayanos
European Finance Association,2022,The debt-equity spread,Hui Chen; Zhiyao Chen; Jun Li
European Finance Association,2022,What Do the Portfolios of Individual Investors Reveal About the Cross-Section of Equity Returns?,Jens Kvaerner; Sebastien Betermier; Laurent E. Calvet; Samuli Knüpfer
European Finance Association,2022,The Cost of ESG Investing,Laura Lindsey; Seth Pruitt; Christoph Schiller
European Finance Association,2022,International Capital Markets and Wealth Transfers,Julien Pénasse; Magnus Dahlquist; Christian Heyerdahl-Larsen; Anna Pavlova
European Finance Association,2022,Collateral Eligibility of Corporate Debt in the Eurosystem,Loriana Pelizzon; Max Riedel; Zorka Simon; Marti Subrahmanyam
European Finance Association,2022,Why Are Returns to Private Business Wealth So Dispersed?,Corina Boar; Denis Gorea; Virgiliu Midrigan
European Finance Association,2022,Climate Change and Individual Behavior,René Bernard; Panagiota Tzamourani; Michael Weber
European Finance Association,3938,Jensen Bounds: Testable Restrictions on Asset Pricing Models,Piotr Orlowski; Alireza Tahbaz-Salehi; Fabio Trojani; Andrea Vedolin
European Finance Association,3938,How Do Acquisitions Affect the Mental Health of Employees?,Ramin P. Baghai; Laurent Bach; Marieke Bos; Rui Silva
European Finance Association,3938,Consumer Choice and Corporate Bankruptcy,Megan Hunter; Samuel Antill
European Finance Association,3938,Can Human Capital Explain Income-based Disparities in Financial Services?,Ruidi Huang; James Linck; Erik Mayer; Christopher Parsons
European Finance Association,3938,Monetary Policy and Corporate Debt Maturity,Andrea Fabiani; Luigi Falasconi; Janko Heineken
European Finance Association,3938,Increasing Corporate Bond Liquidity Premium and Post-Crisis Regulations,Botao Wu
European Finance Association,3938,Shareholder Power and the Decline of Labor,Antonio Falato; Hyunseob Kim; Till Von Wachter
European Finance Association,3938,Distressed Firm Restructurings and Hedge Funds with Expertise: Saviors or Vultures?,Nina Baranchuk; Michael Rebello
European Finance Association,3938,Deputizing Financial Institutions to Fight Elder Abuse,Bruce Carlin; Tarik Umar; Livia Yi
European Finance Association,3938,Motivating Banks to Lend? Credit Spillover Effects of the Main Street Lending Program,Camelia Minoiu; Rebecca Zarutskie; Andrei Zlate
European Finance Association,3938,"Efficient Estimation of Bid-Ask Spreads from Open, High, Low, and Close Prices",David Ardia; Emanuele Guidotti; Tim Kroencke
European Finance Association,3938,Financial Resilience in Labor Negotiations,Alessio Piccolo; Roberto Pinto
European Finance Association,3938,The Real Effects of Legal and Trading Frictions in Collateralization,Bo Bian
European Finance Association,3938,"Interest Rates, Competition, and Complexity: Demand and Supply of Retail Financial Products",Jonathan Krakow; Felix Fattinger; Simon Straumann; Marc Chesney
European Finance Association,3938,The Effect of Tight Monetary Policy on Shadow Banks: Evidence from the Recession of 1920–1921,Haelim Anderson; Selman Erol; Guillermo Ordonez
European Finance Association,3938,How Harmful Is Insider Trading for Outsiders? Evidence from the Eighteenth Century,Mathijs Cosemans; Rik Frehen
European Finance Association,4140,Fed Tails: FOMC Announcements and Stock Market Uncertainty,Thomas Gruenthaler; Heiner Beckmeyer; Nicole Branger
European Finance Association,4140,"When the Markets get CO.V.I.D: COntagion, Viruses, and Information Diffusion.",Maria Jose Arteaga Garavito; Mariano Max Croce; Paolo Farroni; Isabella Wolfskeil
European Finance Association,4140,Cashless Payment and Financial Inclusion,Shumiao Ouyang
European Finance Association,4140,"Activism, Stock Selection, and Indexing in Equilibrium",Steven Baker; David Chapman; Michael Gallmeyer
European Finance Association,4140,Quantifying Dark Matter in Finance: Time-Varying Disaster Risk and Asset Prices,Matthew Baron; Wei Xiong; Zhijiang Ye
European Finance Association,4140,"Information Specialization, Strategic Complementarity, and Market Efficiency: Evidence from Institutional Investors",Massimo Massa; Hong Zhang; Yijun Zhou
European Finance Association,4140,"The digital economy, privacy, and CBDC",Peter Hoffmann; Toni Ahnert; Cyril Monnet
European Finance Association,4140,"An Equilibrium Model of Career Concerns, Investment Horizons, and Mutual Fund Value Added",Jules van Binsbergen; Jungsuk Han; Hongxun Ruan; Ran Xing
European Finance Association,4140,Markup Shocks and Asset Prices,Alexandre Corhay; Jun Li; Jincheng Tong
European Finance Association,4140,Do I Really Want to Hear The News? Public Information Arrival and Investor Beliefs,Azi Ben-Rephael; Tony Cooksony; Yehuda Izhakian
European Finance Association,4140,Customer Data Access and Fintech Entry: Early Evidence from Open Banking,Tania Babina; Greg Buchak; Will Gornall
European Finance Association,4140,Asset Pricing Implications of Heterogeneous Investment Horizons,Idan Hodor; Fernando Zapatero
European Finance Association,4342,The Innovation Arms Race,Muhammad Farooq Ahmad; Eric de Bodt; Jarrad Harford
European Finance Association,4342,Conflicts in Private Family Firms,Janis Berzins; Alminas Zaldokas
European Finance Association,4342,The Financial Restitution Gap in Consumer Finance: Insights from Complaints Filed with the CFPB,Charlotte Haendler; Rawley Heimer
European Finance Association,4342,Merchants of death: The effect of credit supply shocks on hospital outcomes,Cyrus Aghamolla; Pinar Karaca-Mandic; Xuelin Li; Richard Thakor
European Finance Association,4342,Electronic Foreclosures,Francesco Mazzola
European Finance Association,4342,"Innovation, Industry Equilibrium, and Discount Rates",Maria Cecilia Bustamante; Francesca Zucchi
European Finance Association,4342,Mutual funds’ strategic voting on environmental and social issues,Roni Michaely; Guillem Ordonez-Calafi; Silvina Rubio
European Finance Association,4342,Financial Constraints and the Racial Housing Gap,Pierre Mabille; Arpit Gupta; Christopher Hansman
European Finance Association,4342,Cross-subsidization of Bad Credit in a Lending Crisis,Nikolaos Artavanis; Brian Jongh-wan Lee; Stavros Panageas; Margarita Tsoutsoura
European Finance Association,4342,Decentralized Exchanges,Alfred Lehar; Christine Parlour
European Finance Association,4342,Incentive Design for Talent Discovery,Basil Williams; Erik Madsen; Andrzej Skrzypacz
European Finance Association,4342,A Tale of Two Networks: Common Ownership and Product Market Rivalry,Florian Ederer; Bruno Pellegrino
European Finance Association,4342,"Student Loan Supply, Parental Saving & Portfolio Allocation",Emiel Jerphanion
European Finance Association,4342,Fire-Sale Risk and Credit,Dion Bongaerts; Francesco Mazzola; Wolf Wagner
European Finance Association,4342,Equilibrium Staking Levels in a Proof-of-Stake Blockchain,Kose John; Thomas Rivera; Fahad Saleh
European Finance Association,4544,The Inference-Forecast Gap in Belief Updating,Tony Fan; Yucheng Liang; Cameron Peng
European Finance Association,4544,Do financial investors underreact to voluntary corporate disclosure?,Marco Grotteria; Roberto Gomez Cram
European Finance Association,4544,Pricing of Climate Risk Insurance: Regulatory Frictions and Cross-Subsidies,Ishita Sen; Sangmin Oh; Ana-Maria Tenekedjieva
European Finance Association,4544,Currency Risks under Capital Control,Xiang Fang; Sining Liu; Yang Liu
European Finance Association,4544,Dynamics of Subjective Risk Premia,Stefan Nagel; Zhengyang Xu
European Finance Association,4544,Financing Infrastructure with Inattentive Investors: The Case of US Municipal Governments,Ehsan Azarmsa
European Finance Association,4544,A quantity-based approach to constructing climate risk hedge portfolios,Georgij Alekseev; Stefano Giglio; Quinn Maingi; Julia Selgrad; Johannes Stroebel
European Finance Association,4544,An Unintended Consequence of Holding Dollar Assets,Shiyang Huang; Robert Czech; Dong Lou; Tianyu Wang
European Finance Association,4544,Psychological Distance and Deviations from Rational Expectations,Harjoat Bhamra; Raman Uppal; Johan Walden
